,Target words,Attrib. words,Nt,Na,s,d,p,original_N,original_d,original_p
0,Flowers vs. Insects,Pleasant vs. Unpleasant,9x2,10x2,0.3223,1.0393,1.3e-02,32,1.35,1e-8
1,Instruments vs. Weapons,Pleasant vs. Unpleasant,10x2,10x2,0.7967,1.3945,3.5e-04,32,1.66,1e-10
2,European American names vs. African American names,Pleasant vs. Unpleasant,10x2,10x2,0.3676,1.2559,1.4e-03,26,1.17,1e-5
3,European American names vs. African American names,Pleasant vs. Unpleasant,10x2,10x2,0.2435,0.8749,2.7e-02,,,
4,Male names vs. Female names,Career vs. Family,8x2,8x2,0.7939,1.7613,0.0,39k,0.72,< 1e-2
5,Math vs. Arts,Male terms vs. Female terms,8x2,8x2,0.1237,0.6822,9.7e-02,28k,0.82,< 1e-2
6,Science vs. Arts,Male terms vs. Female terms,7x2,8x2,0.0788,0.6683,1.2e-01,91,1.47,1e-24
7,Mental disease vs. Physical disease,Temporary vs. Permanent,6x2,6x2,0.4347,1.3792,9.7e-03,135,1.01,1e-3
8,Young people’s names vs. Old people’s names,Pleasant vs. Unpleasant,8x2,7x2,0.1069,0.4868,1.8e-01,43k,1.42,< 1e-2
