,Target words,Attrib. words,Nt,Na,s,d,p,original_N,original_d,original_p
0,Flowers vs. Insects,Pleasant vs. Unpleasant,9x2,10x2,0.357,0.5919,1.2e-01,32,1.35,1e-8
1,Instruments vs. Weapons,Pleasant vs. Unpleasant,10x2,10x2,0.907,1.1023,6.2e-03,32,1.66,1e-10
2,European American names vs. African American names,Pleasant vs. Unpleasant,10x2,10x2,0.8807,1.6121,3.8e-05,26,1.17,1e-5
3,European American names vs. African American names,Pleasant vs. Unpleasant,10x2,10x2,0.755,1.3516,6.8e-04,,,
4,Male names vs. Female names,Career vs. Family,8x2,8x2,0.6498,1.5575,5.4e-04,39k,0.72,< 1e-2
5,Math vs. Arts,Male terms vs. Female terms,8x2,8x2,-0.08,-0.4662,8.1e-01,28k,0.82,< 1e-2
6,Science vs. Arts,Male terms vs. Female terms,7x2,8x2,0.1492,0.949,3.6e-02,91,1.47,1e-24
7,Mental disease vs. Physical disease,Temporary vs. Permanent,6x2,6x2,0.2096,0.6639,1.4e-01,135,1.01,1e-3
8,Young people’s names vs. Old people’s names,Pleasant vs. Unpleasant,8x2,7x2,0.0606,0.2054,3.5e-01,43k,1.42,< 1e-2
