,Target words,Attrib. words,Nt,Na,s,d,p,original_N,original_d,original_p
0,Flowers vs. Insects,Pleasant vs. Unpleasant,9x2,10x2,0.3615,1.0297,1.3e-02,32,1.35,1e-8
1,Instruments vs. Weapons,Pleasant vs. Unpleasant,10x2,10x2,0.88,1.3863,3.7e-04,32,1.66,1e-10
2,European American names vs. African American names,Pleasant vs. Unpleasant,10x2,10x2,0.43,1.2706,1.2e-03,26,1.17,1e-5
3,European American names vs. African American names,Pleasant vs. Unpleasant,10x2,10x2,0.2844,0.8886,2.5e-02,,,
4,Male names vs. Female names,Career vs. Family,8x2,8x2,0.9015,1.7759,0.0,39k,0.72,< 1e-2
5,Math vs. Arts,Male terms vs. Female terms,8x2,8x2,0.1922,0.9298,3.6e-02,28k,0.82,< 1e-2
6,Science vs. Arts,Male terms vs. Female terms,7x2,8x2,0.1367,0.9813,3.8e-02,91,1.47,1e-24
7,Mental disease vs. Physical disease,Temporary vs. Permanent,6x2,6x2,0.496,1.3541,1.1e-02,135,1.01,1e-3
8,Young people’s names vs. Old people’s names,Pleasant vs. Unpleasant,8x2,7x2,0.0957,0.3559,2.5e-01,43k,1.42,< 1e-2
